{
  "format": "supertonic.unicode.grapheme.v1",
  "properties": {
    "Extended_Pictographic": [
      [
        169,
        169,
        "Yes"
      ],
      [
        174,
        174,
        "Yes"
      ],
      [
        8252,
        8252,
        "Yes"
      ],
      [
        8265,
        8265,
        "Yes"
      ],
      [
        8482,
        8482,
        "Yes"
      ],
      [
        8505,
        8505,
        "Yes"
      ],
      [
        8596,
        8601,
        "Yes"
      ],
      [
        8617,
        8618,
        "Yes"
      ],
      [
        8986,
        8987,
        "Yes"
      ],
      [
        9000,
        9000,
        "Yes"
      ],
      [
        9096,
        9096,
        "Yes"
      ],
      [
        9167,
        9167,
        "Yes"
      ],
      [
        9193,
        9203,
        "Yes"
      ],
      [
        9208,
        9210,
        "Yes"
      ],
      [
        9410,
        9410,
        "Yes"
      ],
      [
        9642,
        9643,
        "Yes"
      ],
      [
        9654,
        9654,
        "Yes"
      ],
      [
        9664,
        9664,
        "Yes"
      ],
      [
        9723,
        9726,
        "Yes"
      ],
      [
        9728,
        9733,
        "Yes"
      ],
      [
        9735,
        9746,
        "Yes"
      ],
      [
        9748,
        9861,
        "Yes"
      ],
      [
        9872,
        9989,
        "Yes"
      ],
      [
        9992,
        10002,
        "Yes"
      ],
      [
        10004,
        10004,
        "Yes"
      ],
      [
        10006,
        10006,
        "Yes"
      ],
      [
        10013,
        10013,
        "Yes"
      ],
      [
        10017,
        10017,
        "Yes"
      ],
      [
        10024,
        10024,
        "Yes"
      ],
      [
        10035,
        10036,
        "Yes"
      ],
      [
        10052,
        10052,
        "Yes"
      ],
      [
        10055,
        10055,
        "Yes"
      ],
      [
        10060,
        10060,
        "Yes"
      ],
      [
        10062,
        10062,
        "Yes"
      ],
      [
        10067,
        10069,
        "Yes"
      ],
      [
        10071,
        10071,
        "Yes"
      ],
      [
        10083,
        10087,
        "Yes"
      ],
      [
        10133,
        10135,
        "Yes"
      ],
      [
        10145,
        10145,
        "Yes"
      ],
      [
        10160,
        10160,
        "Yes"
      ],
      [
        10175,
        10175,
        "Yes"
      ],
      [
        10548,
        10549,
        "Yes"
      ],
      [
        11013,
        11015,
        "Yes"
      ],
      [
        11035,
        11036,
        "Yes"
      ],
      [
        11088,
        11088,
        "Yes"
      ],
      [
        11093,
        11093,
        "Yes"
      ],
      [
        12336,
        12336,
        "Yes"
      ],
      [
        12349,
        12349,
        "Yes"
      ],
      [
        12951,
        12951,
        "Yes"
      ],
      [
        12953,
        12953,
        "Yes"
      ],
      [
        126976,
        127231,
        "Yes"
      ],
      [
        127245,
        127247,
        "Yes"
      ],
      [
        127279,
        127279,
        "Yes"
      ],
      [
        127340,
        127345,
        "Yes"
      ],
      [
        127358,
        127359,
        "Yes"
      ],
      [
        127374,
        127374,
        "Yes"
      ],
      [
        127377,
        127386,
        "Yes"
      ],
      [
        127405,
        127461,
        "Yes"
      ],
      [
        127489,
        127503,
        "Yes"
      ],
      [
        127514,
        127514,
        "Yes"
      ],
      [
        127535,
        127535,
        "Yes"
      ],
      [
        127538,
        127546,
        "Yes"
      ],
      [
        127548,
        127551,
        "Yes"
      ],
      [
        127561,
        127994,
        "Yes"
      ],
      [
        128000,
        128317,
        "Yes"
      ],
      [
        128326,
        128591,
        "Yes"
      ],
      [
        128640,
        128767,
        "Yes"
      ],
      [
        128884,
        128895,
        "Yes"
      ],
      [
        128981,
        129023,
        "Yes"
      ],
      [
        129036,
        129039,
        "Yes"
      ],
      [
        129096,
        129103,
        "Yes"
      ],
      [
        129114,
        129119,
        "Yes"
      ],
      [
        129160,
        129167,
        "Yes"
      ],
      [
        129198,
        129279,
        "Yes"
      ],
      [
        129292,
        129338,
        "Yes"
      ],
      [
        129340,
        129349,
        "Yes"
      ],
      [
        129351,
        129791,
        "Yes"
      ],
      [
        130048,
        131069,
        "Yes"
      ]
    ],
    "Grapheme_Cluster_Break": [
      [
        0,
        9,
        "Control"
      ],
      [
        10,
        10,
        "LF"
      ],
      [
        11,
        12,
        "Control"
      ],
      [
        13,
        13,
        "CR"
      ],
      [
        14,
        31,
        "Control"
      ],
      [
        127,
        159,
        "Control"
      ],
      [
        173,
        173,
        "Control"
      ],
      [
        768,
        879,
        "Extend"
      ],
      [
        1155,
        1161,
        "Extend"
      ],
      [
        1425,
        1469,
        "Extend"
      ],
      [
        1471,
        1471,
        "Extend"
      ],
      [
        1473,
        1474,
        "Extend"
      ],
      [
        1476,
        1477,
        "Extend"
      ],
      [
        1479,
        1479,
        "Extend"
      ],
      [
        1536,
        1541,
        "Prepend"
      ],
      [
        1552,
        1562,
        "Extend"
      ],
      [
        1564,
        1564,
        "Control"
      ],
      [
        1611,
        1631,
        "Extend"
      ],
      [
        1648,
        1648,
        "Extend"
      ],
      [
        1750,
        1756,
        "Extend"
      ],
      [
        1757,
        1757,
        "Prepend"
      ],
      [
        1759,
        1764,
        "Extend"
      ],
      [
        1767,
        1768,
        "Extend"
      ],
      [
        1770,
        1773,
        "Extend"
      ],
      [
        1807,
        1807,
        "Prepend"
      ],
      [
        1809,
        1809,
        "Extend"
      ],
      [
        1840,
        1866,
        "Extend"
      ],
      [
        1958,
        1968,
        "Extend"
      ],
      [
        2027,
        2035,
        "Extend"
      ],
      [
        2045,
        2045,
        "Extend"
      ],
      [
        2070,
        2073,
        "Extend"
      ],
      [
        2075,
        2083,
        "Extend"
      ],
      [
        2085,
        2087,
        "Extend"
      ],
      [
        2089,
        2093,
        "Extend"
      ],
      [
        2137,
        2139,
        "Extend"
      ],
      [
        2192,
        2193,
        "Prepend"
      ],
      [
        2200,
        2207,
        "Extend"
      ],
      [
        2250,
        2273,
        "Extend"
      ],
      [
        2274,
        2274,
        "Prepend"
      ],
      [
        2275,
        2306,
        "Extend"
      ],
      [
        2307,
        2307,
        "SpacingMark"
      ],
      [
        2362,
        2362,
        "Extend"
      ],
      [
        2363,
        2363,
        "SpacingMark"
      ],
      [
        2364,
        2364,
        "Extend"
      ],
      [
        2366,
        2368,
        "SpacingMark"
      ],
      [
        2369,
        2376,
        "Extend"
      ],
      [
        2377,
        2380,
        "SpacingMark"
      ],
      [
        2381,
        2381,
        "Extend"
      ],
      [
        2382,
        2383,
        "SpacingMark"
      ],
      [
        2385,
        2391,
        "Extend"
      ],
      [
        2402,
        2403,
        "Extend"
      ],
      [
        2433,
        2433,
        "Extend"
      ],
      [
        2434,
        2435,
        "SpacingMark"
      ],
      [
        2492,
        2492,
        "Extend"
      ],
      [
        2494,
        2494,
        "Extend"
      ],
      [
        2495,
        2496,
        "SpacingMark"
      ],
      [
        2497,
        2500,
        "Extend"
      ],
      [
        2503,
        2504,
        "SpacingMark"
      ],
      [
        2507,
        2508,
        "SpacingMark"
      ],
      [
        2509,
        2509,
        "Extend"
      ],
      [
        2519,
        2519,
        "Extend"
      ],
      [
        2530,
        2531,
        "Extend"
      ],
      [
        2558,
        2558,
        "Extend"
      ],
      [
        2561,
        2562,
        "Extend"
      ],
      [
        2563,
        2563,
        "SpacingMark"
      ],
      [
        2620,
        2620,
        "Extend"
      ],
      [
        2622,
        2624,
        "SpacingMark"
      ],
      [
        2625,
        2626,
        "Extend"
      ],
      [
        2631,
        2632,
        "Extend"
      ],
      [
        2635,
        2637,
        "Extend"
      ],
      [
        2641,
        2641,
        "Extend"
      ],
      [
        2672,
        2673,
        "Extend"
      ],
      [
        2677,
        2677,
        "Extend"
      ],
      [
        2689,
        2690,
        "Extend"
      ],
      [
        2691,
        2691,
        "SpacingMark"
      ],
      [
        2748,
        2748,
        "Extend"
      ],
      [
        2750,
        2752,
        "SpacingMark"
      ],
      [
        2753,
        2757,
        "Extend"
      ],
      [
        2759,
        2760,
        "Extend"
      ],
      [
        2761,
        2761,
        "SpacingMark"
      ],
      [
        2763,
        2764,
        "SpacingMark"
      ],
      [
        2765,